,0
62,"Sintesi Un prodotto veramente ottimo e raffinato stanno bene all’interno dell’orecchio la riproduzione audio è ottima e la qualità dei microfoni in situazioni di rumore esterno quasi nullo è molto buona quando però c’è troppo rumore ad esempio con musica alta allora soffono un pochino Recensione completa 📦 CONFEZIONE📦 7️⃣/🔟 Lo scatolato in cui è contento il prodotto non rende giustizia al prodotto stesso. Oltre ai vari manualetti e cavetti troviamo i gommini di riserva e le protagoniste 🔎PRODOTTO🔍 9️⃣/🔟 Costruite in plastica opaca e con una dimensione non indifferente le ep-t21 sono un paio di cuffie se avete un orecchio molto piccolo non vi si addicono. Ma con un padiglione nella norma le cuffiette si incastreranno nell’orecchio senza troppi sforzi. Unica pecca la ricarica con MICRO-USB. L’ergonomia è veramente ottima, gli auricolari non pesano affatto e all’orecchio danno l’idea di una stabilita enorme, tranne che nelle chiamate li se si ride le guance sbatteranno sui gambi e le cuffiette si sfileranno leggermente costringendovi a riinserirle per bene. 🔋Batteria🔋 💯/🔟 La batteria è ottima sia quella del case che quella delle cuffiette. Una brutta falla che ho notato è data dal fatto che se la batteria del case è vuota e si ripongono le cuffie al suo interno, loro non si spengono 🔊 suono🔊 💯/🔟 Il volume massimo è molto molto alto e assolutamente non zanzaroso, i bassi sono presenti e sono veramente molto intensi, con volume elevato non gracchiano. 📢microfono📢 💯/🔟 Anche questo è ottimo nelle chiamate l’interlocutore diche che ci sente molo bene anche se le voci di fondo non sono più di tanto soppresse, ma grazie al bastoncino con dimensioni molto generose il protagonista è messe difronte alla nostra bocca . 💢Comandi touch💢 💯/🔟 Comandi veramente ottimi stando sul dorso della cuffia l’azionamento è istantaneo e fulmineo e soprattutto istintivo. 🚚 SPEDIZIONE🚚 💯/🔟 Spedizione perfetta eseguita come al sempre con grande cura da Amazon prime. 💭CONSIGLIO A VOI💭 Consiglio queste cuffie a chiunque voglia godere di un po’ di buona musica senza spendere troppo e avendo un’eleganza non indifferente.molto utili nella vita quotidiana connessione in 2 secondi"
63,"Ho acquistato questi auricolari tramite uno sconto che era possibile applicare quindi anziché pagarli 29.99 li ho pagati 19.99. Acquistati per fare uno dei tanti regali di natale, ma ho voluti accendenderli e testarli. Nella scatola troviamo la custodia che permette la ricarica degli auricolari, quanti posti all' interno(La custodia di ricarica è magnetica quindi quando riposti aderiscono bene nell' alloggiamento), nonche gli auricolari, un cavetto per la ricarica, dei gommini di ricambio in diverse taglie, un Libretto informativo in varie lingue tra cui l'italiano. Gli auricolari sono molto leggeri e quando indossati sembra di non tenerli alle orecchie. Il pair Bluetooth con lo smartphone è avvenuto in pochissimi secondi e ricordo che il Bluetooth è 5.0 quindi di ultima generazione e non noteremo alcun ritardo con quello del dispositivo a cui siamo collegati (quindi niente ritardi nell audio di video/film). Il suono è di qualità e non distorce: Bassi potenti e alti chiari e cristallini. Gli auricolari hanno funzioni attivabili con il touch (sia il sinistro che il destro). Infatti potremo rispondere/rifiutare ad una chiamata, mentre nell' ascolto di musica passare tra una canzone e l'altra, abbassare/alzare il volume, compatibili quindi con le app di musica online come amazon music. Le ore di utilizzo con 1 sola ricarica degli auricolari sono circa 5, mentre la batteria della custodia se carica completamente permette 4 cicli di carica completi degli auricolari. Sono molto soddisfatto di questo acquisto e credo che la persona che li riceverai in regalo lo sarà lo stesso! Spedizione prime impeccabile: arrivati il giorno dopo aver effettuato l' ordine! CONSIGLIATI!"
64,"These Bluetooth earphones are simply the best value for money I have found. They have good sound quality, easily good enough for me and my needs (phone calls, YouTube videos, pod casts, and some music), and probably be great for most people outside of the music or video/ film industry. The Aukey headphones come with ea charging case, which extends the battery life to ~25 hours, but I normally just charge the case once every couple of weeks, to ensure they keep going. They have a microphone in each ear piece, to make phone calls sound good, and very easy to pair and just use. The usability is great, open the case and insert a ear piece into the ear, and they will connect in about that time. I have the Anker Soundcore Life P2, which are an equivalent to these in terms of price and functionality. the Anker are a little more expense (about £5 to £10, depending current pricing and offers/ vouchers), but they come with 4 mics (2 in each ear piece) and have 40 hour battery life, so quite similar. They both don't really have noise cancelling, and at best have some in call nice reduction for the other party, to help with voice/ video calls, but you don't really expect full blown noise cancelling at this price anyway, you need to be spending about £100+. I honestly find the Aukey ones a better value, as they are cheaper, and functionality and features wise are very similar. I can not really differentiate between the Aukey or Anker ones on sound quality. The only really difference for me is the fact that the Aukey ones turn off the LED from flashing, when in use, so people you are talking to don't get distracted by the flashing light, as they do with the Anker ones. Also quite useful when trying to put little ones to sleep, and flashing LED lights are a big distraction for them Overall great headphones, only 1 star removed as they really don't have noise cancellation, and its a shame they don't support a USB-C charging port, so I only need a single cable for my phone, tablet, laptop and also earphones."
65,"Ok so I bought these ear buds to go with my new phone which does not have a headphone jack. I wanted something small, light and comfortable. These fit the bill because they also come with a small charging case for carrying them around. They are small, light and very comfortable to wear for long periods. I mainly use these when walking the dog or going for a run and have to say the sound quality is excellent. The touch controls on the Earbuds work well too and are a very good addition to the Earbuds. They stay in the ear very well when running and walking and I got wet the other day on a run and they were fine. The charging case is very good and charges the Earbuds as soon as you put them in. Connection to my phone was very simple and took about 20 seconds. Now as soon as I take the Earbuds out of the case they connect to my phone and I'm ready to go, its really that simple. I have to give these Earbuds 5 stars because they work great, the sound quality is excellent and the charging case is brilliant."
66,Ce sont de bons petits écouteurs Bluetooth qui font bien leur job. Ils sont effectivement waterproof et le micro est de bonne qualité. Ils sont livrés avec un chouette étui de rangement et des embouts de rechange. L'apparaige est rapide et ils ont été reconnus par tous mes appareils récents et plus âgés. Le système de fixation fait qu'ils tiennent très bien sur les oreilles et se font vite oublier. La durée de vie de la batterie me semble des plus correctes : je ne l'ai pas encore rechargée après plusieurs heures d'écoute. :-) Ça me semble être un bon rapport qualité prix.
67,"J’ai acheter c’est écouteurs pour la salle de sport car je n’aime pas courir sur un tapis ou même en extérieur avec un fils qui se balade, A l’ouverture j’ai etait surpris des accessoires fournis (boîte de transport passe partout, 3 tailles d embout, une paire d’embout a mémoire de forme, et une petite pince pour serrer le câble des écouteurs. J’ai reçu les écouteurs charger a 100% très bon point, connexion très simple suffit de l’allumer est d’activer son Bluetooth est de cliquer sur les écouteurs. Parlons maintenant du son qui est pour moi très très bon ! J’utilisais des écouteurs Apple filaire sur un iPhone 7 le son est vraiment identique voir un peut mieux une bonne présence des basses, est avec un peut de réglage on peut vraiment avoir quelques chose de très bien. Les écouteurs ne font bas de gamme, et il tiennes vraiment bien quand on bouge. Je recommande grandement se produit pour les personnes qui ne veulent pas dépenser énormément d’argent dans des écouteurs pour le sport, qui peuvent aussi bien être utilisé tout les jours."
68,"déjà détenteur des Mpow Wolerine ,j'ai racheter ces Mpow flame pour ma femme et son footing ,elle préférè le maintien derrière les oreille, il sont moins discret mais par contre une qualité de son bien supérieur notamment au niveau des basses et de la spatialisation stéréo.Comme souvent avec les produits Mpow un rapport qualité prix excellent et une belle finition."
69,"J'ai acheté ces écouteurs pour les utiliser en salle de sport. Ils sont vraiment top pour le prix, un son nickel même dans les basses, tentez la musique 8D avec, c'est excellent. Pratique à utiliser avec les boutons de l écouteur droit : volume, changer de musique, recevoir un appel et discuter. Il y a 3 embouts différents pour les oreilles. Je suis vraiment contente de mon achat. Expédition rapide et soigné."
70,Le son n'est pas le meilleur mais je m'en sers tous les jours dans les transports depuis 6 mois et toujours impeccable. Trajet de 45' le matin et le soir et la charge me fait la semaine. De plus le boitier permet de les ranger correctement dans mon sac. Je suis très content de ce produit.
71,Alors sincèrement je rejoins à 100% tous les commentaires précédents ! N'hésitez pas ces écouteurs à ce prix est parfait pour les sportifs ayant besoin d'un produit confortable complet waterproof avec une autonomie plus que convenable et le son !! C'est 10x mieux que mes JBL Filaires je pèse mes mots et suis très au détail sur le son .. Led Témoin bleu clignotante par intermittence .. possibilité d'avancer reculer diminuer augmenter éteindre Mute .. livré avec câble USB et oreillettes de rechange avec taille ! Son boîtier de rangement pratique discret c'est juste nickel en tout points.. possibilité de coloris qui plus est donc honnêtement 20€ 😄 on ne chipote pas ! Bravo
72,"Identique au HBUDS 01: Acheté ceci après une paire de beats x: j'ai aimé: - résistant à l'eau. essayé dans la douche - meilleure autonomie que beatsX - bonne qualité sonore - charge rapide (pas aussi rapide que beatsX, mais 5 fois moins cher) - très bon prix ( ~20 euros) - étui de protection (beatsX en a une qui est une blague) - bonne isolation acoustique choses que je n'ai pas aimé: - LED qui est toujours allumé - indicateur de batterie a besoin de plus de travail: montre 90%, après 1h encore 90% et après un autre 1h tombe à 60% tout d'un coup - design: trop grand à mon avis (je reviendrai sur les oreillettes)"
73,"Ma fille est ravie de ses écouteurs, mieux que ceux qui ce branche."
74,"Ecouteurs bluetooth doté d'un dock de recharge portatif. C'est un concept que j'apprécie beaucoup. Il suffit de recharger le dock noir qui sert également de stockage pour les écouteurs et vous pouvez les transporter partout. Si vous allumez le dock, les ecouteurs s'allument et se mettent à se charger. Vous pouvez si vous le souhaiter les demarrer manuellement. Les ecouteurs passent en phase d'apparaillage bluetooth. Ce fut assez laborieux pour l'apparaillage mais je m'y suis mal pris. Maintenant dès l'allumage des ecouteurs mon telephone se connecte directement. Concernant la qualité d'écoute, elle est très bonne, il y a forcement mieux mais ces ecouteurs satisfairont la pluspart des gens. J'avais peur que les écouteurs tombent durant une activité physique mais finalement il n'y a pas de soucis ils tiennent bien."
75,"Vrai expert en la matière / Écouteur à déconseiller - Ne surtout pas acheter - Arnaque 1. Ce n'est pas tactile mais bouton poussoir avec clique mécanique ( Sensation horrible dans l'oreille ) 2. Bluetooth avec des lag énormes, temps de latence, en fait si on n'est immobile ça fonctionne mais dès que l'on bouge déconnexion permanente, testé sur tout environnement IOS, Android, Iphone X, Samsung S8+ , 9+ , Asus zen, Motorola One ... 3. Beaucoup plus d’aiguë que de grave 4. Batterie se décharge à une vitesse hallucinante que ce sois en streaming audio ou vidéo 5. Un des écouteur ne fonctionne plus du tout après, allez un mois d'utilisation en va dire à hauteur d'une heure par jour environ 6. Pour résumer NE SURTOUT PAS ACHETER, mieux vaut mettre 10 euro en plus et prendre un de meilleur qualité"
76,"retour d'expérience après une petite semaine d'essai * la qualité du son est bonne pour la taille des écouteurs à la différence d'autres écouteurs qui pourrait fournir des son moins profond. * la communication est bonne et sans écho même à travers un bonnet. * le boîtier fournit avec les écouteurs permet de recharger les écouteur même sans avoir un accès à une prise. Gros plus! Le pairage est simple avec une pression continu sur les deux écouteurs et investment pour se deco, il faut chercher TI8S comme appareil Bluetooth. Bref ça tiens bien, c'est du bon son et j'en suis pleinement satisfait pour mon usage vélo - marche - jardinage"
77,"J'avais besoin d'une paire d'écouteurs bluetooth pour le sport et je ne souhaitais pas y mettre un prix de fou (exit AirPods et galaxy earbuds). Mes attentes n'étaient donc pas très élevées en achetant ce produit et j'ai été fort agréablement surpris! L'appairage est ultra simple, le son est vraiment bon (meme les basses), l'autonomie est supérieure a mes besoins et l'ergonomie est parfaitement adaptée à mes oreilles. Une vraie bonne surprise et un rapport qualité/prix imbattable!"
78,"Achetés pour remplacer lors de mes sorties running à la place d'un casque (un Turbine 2ts), je suis agréablement surpris par la qualité sonore de celui-ci, les autres intras que j'avais eut étaient toujours avec des faiblesses dans les basses, un peu criards. Loin de ceux là, celui ci est équilibré, et les écouteurs tiennent bien dans les oreilles. La qualité du son est très bonne, la réduction du bruit est efficace, et ils ne bougent pas pendant un exercice physique, tout ce que l'on attend d'écouteurs comme ceux ci!"
79,"Je cherchais des écouteurs sans fil qui tiennent la route, à la vue du prix de ceux-ci, j'ai eu un léger doute quant à la qualité. Il faut comprendre que tout ce qui est chinois n'est pas mauvais. Tout ce qui n'est pas cher n'est pas non plus mauvais. J'ai reçu dans les temps, toute petite boite qui tient dans la paume de la main, à l'ouverture, je voyais les écouteurs en train de se charger grâce à la boîte, à peine je les retire de leur cocon que je peux me connecter avec mon téléphone OnePlus sans soucis ! Le son est de très bonne qualité, ça reste des écouteurs donc le son se laisse entendre par les personnes proches s'il est trop fort, mais ce n'est qu'un détail. Les remettre dans sa boîte une fois l'utilisation terminée et ils se rechargent tout seuls. La connexion au téléphone se fait toute seule ensuite rien qu'en enlevant les écouteurs du boîtier ! Un appui sur un écouteur de n'importe quelle oreille pour couper la musique ou la reprendre si on vous parle !"
80,"Elles tiennent vraiment bien dans les oreilles (même pour une séance de running) et sont vraiment confortables. Le produit est d'ailleurs fourni avec 3 tailles de bouchons afin de satisfaire toutes les largeurs de conduit auditif. Très beau design pour ces excellentes oreillettes qui délivrent un son de qualité grâce notamment à un système de réducteur de bruit extérieur intégré. Présence des basses et aigus avec un parfait équilibre et la sonorité en stéréo est claires et pures. Les écouteurs sont retenus magnétiquement dans le boitier pour éviter de les faire tomber si celle-ci s'ouvre. La recharge est simple, il suffit de replacer les oreillettes dans sa boite, un indicateur de LEDS permettent de visualiser l’énergie restante."
81,"Das Preis-Leistungsverhältnis ist einwandfrei kann ich vorab schon einmal sagen. Kommen wir zu den Einzelheiten: Pairing = unkompliziert Verbindung = Einmal gepaired, verbinden sich die KH automatisch mit dem jeweiligen Gerät sobald man diese aus der Ladebox nimmt. Beim ersten Mal herausnhemen geht der Kopfhörer in den Pairing Modus. Finden die Kopfhörer das Bluetooth Gerät nicht, wechseln sie nach ein paar Sekunden in den Pairing Modus (sinnvoll wenn man BT absichtlich aus hat um ein zweites Gerät zu pairen). Ausdauer = bis zu 6 Std. wenn voll geladen Tragekomfort = angenehm, man merkt die Kopfhörer kaum. Verschieden grosse Silikon buds sind zum optimalen Tragen dabei. Bedienung = gut, aber etwas präziser wäre toll Verarbeitung = ist ganz ok, Gehäuse der Ladeschale mutet etwas billig an Klang = ist klar und ein wenig basslastig aber recht gut Abschirmung Außengeräusche = sehr gut Gewicht der Kopfhörer = angenehm leicht Powerbank = funktioniert einwandfrei mit verschiedenen Geräten. Mit Statusanzeige aussen an der Ladebox. Leuchtet auf sobald die Kopfhörer und/oder ein externes Gerät geladen wird. Gleichzeitiges Laden der Kopfhörer und eines externen Geräts ist kein Problem."
82,"Ich habe dieser Kopfhörer oder EarPods bestellt, weil ich eine nach einer Alternative zu den immer recht großen und sperrigen on Ear Kopfhörern gesucht habe! Was mich natürlich bei anderen Kopfhörern am meisten gestört hat, ist das ständig nervende Kabel. Das Gute ist, dass es bei diesen Kopfhörern kein Kabel gibt :) Anbei habe ich ein paar Bilder zu den Pods, damit ihr euch einen kleinen Eindruck verschaffen könnt. + 3 Stöpsel in unterschiedlichen Größen, (klein, mittel und groß) + Beigelegtes USB Ladekabel + Sehr leicht und angenehm zu tragen + Ladestatus wird in der Box angezeigt + Lassen sich sehr leicht mit dem Smartphone verbinden (wenn man sie einschaltet, dann spricht eine Stimme und gibt einen die Info ""Pods ON oder Pods OFF"") + Magnetisches Case Ich bin sehr von den Pods angetan und es ist eine echt gute und kostengünstige Alternative :)"
83,"I've wanted wireless earphones that are individual ear pieces for quite some time now, but I couldn't bring myself to splurge £150+ on a pair of AirPods, so I thought I'd take a punt with these. And man, I am so glad I did. Firstly, the sound quality from these things is amazing. Really rich sounds with a great level of bass. I'm hearing sounds and instruments in songs that I've been listening to for ages! When you consider that this is one of the main reasons you buy a pair of headphones, getting this level of quality for £30 is not something I would usually expect. Pairing is incredibly easy. After you do it the first time on your phone/device, it'll always be straightforward. It's as simple as getting the earphones out of their case, and before you can even put them in your ears, they're already ready to go. The case itself is very handy, as it also functions as a power bank. You could probably get a charge/just under for a phone, so I find it's something that would probably be good as an emergency, rather than a dedicated power bank. The case at full charge should be able to provide the earphones with a good level of recharges, if the description is to be believed. Speaking of which, battery life seems good, but I've not been able to fully give it a test yet. I've been listening today for a couple of hours (the longest stretch in the few days I've had them), and my iPhone is still reporting that they're on 100% battery. The fit seems snug, but this will be properly pushed when I take them on a run. But I've worn them on a general walk about and they've felt secure. The box comes with quite a few different bud fits if you need to adapt them for your ears. The gestures on the earphones are pretty simple, with a handy instruction manual telling you what accomplishes what. In practice, they're pretty efficient. I, like most, have accidentally put music on/off as I've been putting them in my ears due to touching them, but this is minor and you learn to stop it after the first few times. It usually registers your touch accurately, but because of how they sit in your ear, you might have to fiddle around with positioning etc. But this is a minor niggle. Overall, this is a fantastic investment. If you need to enter the wireless earphones game but don't want to ball out, then at £30 for these, you can't go wrong. EDIT: so after having used them for a few days, I can confirm that the battery life is give or take what it states, in terms of a single use giving 4-6 hours of use. I did have some issues with the left earphone not performing as optimally in terms of the charge/gestures compared to the right, but I reached out to the seller whose service has been prompt and very helpful."
84,"I’ve had these headphones about a week now and I’m very impressed with them. I wasn’t sure what to expect for £20 but I’ve been pleasantly surprised. They came via prime delivery which was great and once I opened them I was once again very happy. They connected to my phones Bluetooth in seconds so I didn’t have to waste time. The sound is great and they feel light in your ears so they don’t cause any disruption. I used mine for running and also mountain climbing and they stayed in my ears no problem at all. They come with extra earcups so if the first ones don’t fit then there is another size to try. When you charge the earphones all you do is plug them into the little docking box which is supplied with them. They will instantly start to charge and it does not take a long time to reach full charge. They also have a good battery life which is great if you are having a day out or maybe running a long distance. I try to review based on quality , look and price and these headphones exceed in all 3 and they won’t sting your pocket at all. Very happy 😁🎧🎶"
85,"These are amazing! High quality sound and IPX56 which means they are highly dust proof and waterproof. They have great base and sound is crystal clear. They are very easy to use and easy to pair to your phone. Once paired, they will pair automatically. The connection is very stable with a ten metre range. They are very comfortable to wear and stay in the ears. You can hear your music even in noisy environments. With the built in switch control you are able to control your music and calls. They come with a small magnetic portable charging case which is able to charge the headphones on the go. With the earphones you can get upto four hours of music or talk time on a single charge. You can charge upto five times with the case. No more having to take your charger wire out with you. The charger is very lightweight and small and it will fit in your pocket. Different size eartips are included, to allow you to obtain the perfect fit, plus instructions. The price is excellent for all the features especially being IPX56 rated. Superb value and amazing earphones. I highly recommend this product. If you found this comment helpful please press the button below. Thank you :)"
86,"Recently purchased this product as I was in need for some wireless earbuds to use when excercising. They arrived very quickly and I great condition! Also it was very simple to set and it came with other sized buds so I could change them to fit my ear size. The sound quality is great, they’re noise cancelling and the battery life is great, keeps me going days and days! Would definitely recommend!!"
87,"I was looking for a set of budget Bluetooth earphones for travelling and after a search came upon these. They are comfortable to wear (with lots of different ends of different sizes) and are small enough to wear for long periods whilst easily recharged using the supplied charging box that doubles as a storage box. Sound quality is good, not too much bass and not at all muffled or muddy like some earphones I've tried. These will work as general purpose multimedia earphones as well, for example to use while watching films on the phone. All in all, a well made item that doesn't break the bank but offers good value for money."
88,Die Sendung ist angekommen wie erwartet. Amazon hat dazu 5 Sterne verdient. Die ArtikelVerpackung sieht sehr schön aus. Zum ersten Mal war ich einfach umgehauen was die soundqulität angeht. Mit dem tatsch Funktion kann man ohne Probleme alles damit steuern. Was die kleinen Dinge alles machen können: Audios bzw. Videos an/ausmachen Telefonieren weil die mit Microphone ausgestattet sind Anrufe annehmen/ablegen Noch effenzienter ist der kleine bis vo die Hörern gesteckt sind zum aufladen. Der bis ist selber mit einem Akku ausgestattet. Sodass Mann auch es überalll mitnehmen kann auch wenn kein Strom zu Verfügung steht. Meine weitere Empfehlung
89,"I didn't know what to expect with this in-ear buds, but I was pleasantly surprised. The box they come in acts as a docking/charging station, which is quite cool. They come with a (short) USB cord and different sized earbuds. I had to charged them initially for about 10 minutes and when they are fully charged the red light will go off. Whilst charging the dock flashes blue. I placed them in my ears, turned Bluetooth on from my phone and the earbuds paired almost instantly with no problems. I have used them for listening to music, taking incoming calls and when at the gym. For the money, they are well worth it !!"
