,0
276,"Le son est très bon pour la musique, en même tant Sony on s'y attend. Isole bien du bruit extérieur. Commandé en bleu il est très beau. Ne sert pas trop la tête, réglable, livré avec 50% de batterie et un câble.. Il ne se plie pas, je n'avais pas fait attention. LES APPELS NON NON c'est juste impossible! on entend des échos insupportables, mon correspondant entend plus les échos que moi qui lui parle, et pareil pour moi.... Et nous avons testé de suite à réception du colis donc aucun bruit chez moi, chacun dans une pièce fermée. ====Retour à l'expéditeur J'ai DEUX JBL et je n'ai pas ce problème d'écho"
277,"Le casque est très sobre et d'un joli bleu. Le son est très bon. L'autonomie semble bonne, je l'ai chargé qu'une seule fois et Jen suis à plusieurs heures d'utilisation. Il est bluetooth, mais j'aurais aimé un câble pour le brancher au pc par exemple car mon pc portable n'a pas de bluetooth. Sur un autre casque acheté auparavant il y avait un cordon pour relier les appareils non bluetooth et voilà pourquoi mon 4/5."
278,"This is the first time I had been sent a product before it was publicly released in order to write a review, so I felt it only right to do a thorough product analysis. Below I have left a pros on cons list with explanations for each point. Pros: Sound - The sound is excellent, no two ways about it, no static, no hum and no muffling. It sounded sharp and clear for music, videos and telephone conversations. Microphone - This headset allows you to do hands free calls with it's built in, internal, microphone. Due to the microphone being inside the right ear drum I was worried that my voice would sound quiet but, according to the person on the other side of the phone, it doesn't sound any different from a normal phone call. Glasses - You'll have no problem wearing glasses while sporting the headset. It doesn't cause any pinching or squeezing. Light-weight - It's surprisingly light. Most wireless headsets have a bit of heft to them but, this one, I can imagine carry around without worrying about getting tired. Durable - With it's size and weight I was worried that it wouldn't be able to survive falling off someone head. So in order to find out I dropped it onto a hardwood floor from about 6 ft, twice, and was pleasantly surprised that not only did it survive but didn't have a mark on it. Cons: Little sound cancelling - It does very little to stop noise from escaping or entering. I found that while playing music the people around me could hear what I was playing if I had my volume at around 50%, I could also hear most things that were going on around me. Size - It's quite small, which can be a good thing, but I found the ear pads weren't able to cover my ears (Which may be while there's little sound cancelling). I had a female friend try them and she found that it was actually a tad too big, causing the pads to hang a bit low on her head. No head padding - Usually you'll find a pad on arch on the headset to add comfort, but not on this headset. I found the hard plastic very uncomfortable. However someone else I had wear the headset didn't mind the lack of pad, so I guess it'll depend on your head shape. Small charging cable - This is a small quibble but the charger that came in the box is remarkable small. It's a standard C charger port so this won't be a problem for most people. Overall it's not perfect, but for the current selling price of £50 I think you'll get more than your monies worth."
279,"Buscaba unos auriculares que pudiese emparejar mediante bluetooth a mi televisor. Finalmente, tras mucho mirar, me decidí a comprar los Sony WH-CH510, y puedo decir que estoy muy satisfecho con la compra: - Estéticamente, muy bonitos. No es tan fácil encontrar unos auriculares blancos que sean estéticos. - Muy, muy ligeros. - Gran autonomía. - Súper sencillos de utilizar. - Y de momento, muy cómodos. Así que he acertado totalmente con la compra de estos auriculares."
280,"I really can't see how these headphones have such a high rating, they absolutely suck! Granted I only paid £35 for them but still there's tonnes of cheaper headphones that feel miles better. The headphones supposed RRP at £50! They aren't particularly comfortable, don't cover the whole ear so noise cancelling is non existing and the sound quality is poor. As soon as I took them out of the box I knew they were crappy, they look and feel cheap. I've just bought the Tribit over ear headphones for £39.99 and they are 100 times better! Do not buy these headphones!"
281,"I have tried a multitude of headphones over the years everything from JVC, Sony, Sennheiser, Philips, WeSC to Grado, Bang & Olufsen and everything in-between. For my money, Grado makes the very best over-ear headphones I have ever bought and they also have exemplary after-sales service. I received these Sony headphones and they are the sixth Sony's I have tested. I have tested the 1000 M3's to a set which retailed over £200 which were designed for Hi Fidelity and now these. From the packaging to the actual product they are nice quality and the sound they produce, given the price, is very good. The big problem in rating headphones and earbuds is that the sound they produce and how they sound is very subjective to review, as two people can listen to a piece of music but they can hear that piece of music differently. In light of this, I am going to try and be as objective about these Earphones as I can. Let us start this review by considering the price, £49.99 at the time of review. This is a good price given the quality of what you are given. They are extremely well made. Everything from the box to the headpiece appears to be top quality., given the low price The headphones themselves are made of quality materials and are quite light. What is not good is that there is no cushioning on the headband. They are not that comfortable to wear over a long period, as I have a large head and need some cushioning. The sound they produce is very good given the price. The reproduction is rich and clear, the bass is fantastic, the middle range is clear and defined and the treble is delightful. The only downside to these phones is the bass, it just lacks a bit of depth. I was not expecting great things from these headphones, yet what they give you in terms of sound quality is very good, given the price. To summarise, these headphones are very well made and produce a sound that is very good. They offer value far beyond the price point. Where they are let down is in the noise-cancelling department. These phones are designed to be used on the go. The amount of background noise is, therefore, going to be loud. This set has no noise-cancelling system and so it kind of defeats the purpose of the set. You have to ask yourself, do you need NC as you journey around? If you don't need it, these are pretty good headphones for the price."
282,"I wanted to wait a few weeks so I could give a fair review. I must say I am impressed with these headphones! To give a bit of background, these are the first set of wireless headphones I have owned. Previous to that I owned a pair of wired Sony headphones, similar to these. I love my music, and really enjoy listening to good quality sound. My initial impressions on the headphones are good. They feel very sturdy and I love how the ear cups twist so that the headphones can be stored flat in my rucksack. Connection to Bluetooth was very quick and easy, and I was able to start listening to Spotify on my phone within 2 minutes! After a full charge overnight, I was intreiged to see how long the headphones would actually last, given the advertised 35 hour battery life! Whilst I haven't kept a diary persay, as a minimum I use the headphones for at least 4 hours a day on my commute to and from work. Each time you turn the headphones on, you have a battery notice played to you, as well as a battery indicator shown on my phone. The headphones lasted for around 7 or 8 days before the headphones advised me to recharge. I haven't run the headphones right down flat, but I would say the 35 hour life is very accurate. These are on ear headphones so it would be unreasonable to expect complete noise cancelling. I wanted a pair of headphones that would not deaden my surroundings completely as I think it's important you aren't completely unaware. However I would say the headphones cancel noise enough to be able to hear the music. I occasionally use the headphones to make and receive telephone calls, both in the office at my desk and whilst commuting. The quality is fantastic, and I've not experienced any problems with the person on the other end not being able to hear me - big thumbs up for this feature! Thinking about the reviews I saw before buying these headphones, I will do my best to remember them and give my own thoughts. - The volume of the headphones are too low, even on the highest setting. I saw a few reviews saying this, both on amazon and a few other sources. I have personally not had any issues with the volume (or lack of) on these headphones. My music taste is varied, and even the softer genres play just fine for me. It may be worth noting that there are two volumes to adjust, your phone and the headphones themselves. Depending on the device you may also be able to adjust the graphic equaliser somewhat if needed. - The headphones are too tight on my head There has only been one occasion where I have experienced a bit of pain on my one ear, however I think they were ill-fitted as I adjusted them on my ears and they were fine thereafter. I would say I have an average sized head! I think you have to bear in mind that these headphones sit on your ears, so they will compress somewhat, so they stay on your head. I would not want them to be looser as I would be conscious they would slide around and potentially fall off my head. Some have suggested that the band itself is uncomfortable, again, I've not had any issues with this regard. All in all I think these are a really great set of headphones for the price. If your a more serious music listener then you may want to consider an alternative option, but I would consider these suitable for most!"
283,"Perfect for a low cost Bluetooth headphones, clear sound, NOT nfc so works with my laptop, smartphone & smart TV. Fairly big battery, lasts me 3/4days usage. Bluetooth connection is very good, some dropout when moving around (about 5m from device). Sleek minimalist design, very light too and comfy. Far superior to JVC equivalent."
284,"The ratings I have given reflect the price, about £35. I am very pleased - bought them for listening to podcasts, making calls, and a bit of music. This is actually the second pair, the first had a very unstable bluetooth connection to my Huawei P9. The reference guide cautions against using it near wifi devices but wifi is everywhere now, and I have no problem with my Plantronics earpiece and other devices so I decided the first pair was faulty and sent it back. The replacement arrived the next day and proved me right - the second pair works perfectly. There is no noise cancellation but isolation is quite good, I can't hear my wife talking to me at all when listening to music. They are not the most hifi of headphones but at the price they are perfectly OK - natural, rather than boomy bass and not over bright. Just as well because I have found no way of adjusting anything but the volume on the headphone or the Huawei. Call quality is...good enough [EDIT: after 3 months use I would be less grudging - I have yet to have trouble hearing or being heard]. The first pair had poor microphone gain but I have had no complaints [after many] long calls on this second set. Not quite as precise as the £15 wired Sonys that this item replaces, but I ascribe that to the microphone being further from the mouth. It's just a little bit echoey, and one's own voice is delivered into the earpieces which was a bit odd for a minute or two but I seem to have got used to it now and don't notice. [EDIT: Since I wrote the above, and thanks to the BBC Rutherford & Fry podcast, I now know that this 'feedback' is just the deliberately engineered ""sidetone"", part of the purpose of which is to prevent people speaking too loudly on calls. I am completely accustomed to the headphones now and I am never aware of it]. I have read that the older CH500, available for a similar price from Amazon, has better call quality and is marginally better for music - but it is not quite as compact, nor does it charge as quickly or last as long - 20 rather than 35 hours per charge. Happy to recommend these. UPDATE. The battery life is indeed good. It typically three or four days, used for 2-3 hours each day, before the ""full battery"" message at switch on became approximately 70%"". I recharged them anyway and continue to do so within a day or two of this alert. One caveat - I have an average sized bonce but I need very little extension on this headset. My wife's head is rather smaller, and in fact it is slightly too big for her at minimum size. If a standard baseball cap is too big for you, probably best look elsewhere."
285,"Appena ho visto questo nuovo modello di queste cuffie Sony e per di più in offerta ho proceduto subito all'acquisto. A questo prezzo sono veramente un affare, hanno un design veramente discreto, non sono per nulla ingrombanti e soprattutto sono molto comode. Hanno un autonomia di batteria veramente longeva e la ricarica è piuttosto veloce, per quanto riguarda il suono i bassi si confermato come in tutti i modelli di cuffie Sony il loro punto di forza, molto definiti e riescono nel loro complesso ad isolare bene, ma c'è di meglio e se siete audiofili logicamente puntate ad altro. Questo modello è indirizzato all'ascoltatore tradizionale . Ultimo ma non meno importante . L'associazione con gli altri dispositivi bluetooth, come : smartv, dispositivi Android e iOS, il PC è davvero semplice e immediata. A differenza di altri modelli di cuffie senza fili Sony che richiedono l'installazione dell'applicazione ufficiale per l'associazione e funziona solo con determinati dispositivi, questa non ne ha bisogno ed è universale. Consigliata!"
286,"Solitamente non recensisco prodotti ma questo se lo merita tutto! Esteticamente le cuffie si presentano bene ma una volta indossate iniziano i problemi: - In chiamata confermo quanto già espresso da altri utenti, ossia che si sente un fastidiosissimo rimbombo; - Terribilmente scomode, dopo 10 minuti ti vien voglia di liberarti...e le orecchie puntualmente ringraziano; - Portata bluetooth limitata; - Volume massimo da ridere, nulla a che vedere con miei attuali auricolari non in ear pagati tre volte meno. Restituite il giorno dopo."
287,Amazing headphones. At a great price perfect sound and there’s not any lag when watching a movie. I’ve had them for 3 days now and used everyday and still not had to charge them still have around 40% charge Comfortable on the head and ears. Noise cancellation is great can’t hear a thing from outside world when using. Would recommend to anyone looking for a low/mid priced wireless headphones. Your getting high quality they look and work as if they were top end quality. Worth a buy!
288,"El producto llegó relativamente pronto 3/4 días. Son un auriculares de precio medio, no muy baratos pero tampoco excesivamente caros , pero por este precio deberían tener algo más de calidad, es plástico rígido llegando a ser molestos si los llevas puestos más de media hora , además la parte superior llega a ser molesta porque no tiene almohadilla que amortigüe la sujeción en la parte superior de la cabeza , eso sí, tienen buena sujeción para el gimnasio y el sonido es bueno , sin llegar a ser fabuloso !! Estuve a punto de devolverlos, pero como ponen tantas condiciones para su devolución por eso de que si le quitas el plástico de la envoltura ya no es posible , ( si no le quitas el plástico cómo vas a saber si te gustan ?? ) , finalmente he decidido quedármelos y usarlos hasta que me canse de ellos. Mi valoración sincera es que no valen la pena, los he probado mejores y con un precio más bajo de la misma marca u otras de primera línea."
289,"A favor tengo que decir que son los auriculares más cómodos que he probado nunca. Padezco muchísimo de dolor de orejas, o sea todos los auriculares al poco tiempo me hacen daño (sean del precio que sean) y estos los llevo puestos horas (más de 6h seguidas) y no noto que los llevo puestos. En contra, no se si durarán mucho porque son de plástico muy ligero y no me dan mucha confianza. Además yo tengo la cabeza pequeña y la primera vez he notado como que me presionaba bastante (al rato como he dicho anteriormente, perfecto, ya no notaba nada). Así que a lo mejor a alguien con tamaño de cabeza normal/grande le puede molestar bastante. EDIT: Después de casi dos meses usándolos he de decir que siguen siendo igual de cómodos, se escuchan genial y tanto la conectividad como la batería una pasada. Respecto a lo que dije de que no tenía mucha confianza de cuánto durarían al ser de plástico ligero, he de decir que son más resistentes de lo que parecen, ya que les meto bastante caña (se me han caído varías veces ya) y están perfectos."
290,"I was given a pair of these for my birthday a week ago. Bluetooth was easy to set to my various tablets, laptop, phone and i pod and I find in use that they have a pretty decent range. The greatest impact was from the sound quality which I find really excellent. Great bass, mid and treble gives an overall well balanced sound regardless of the type of music played and the main controls are on the right hand earphone. I thoroughly recommend these phones, especially at the 'Black friday' price of £35. They are an absolute steal"
291,"Sehr geehrte Damen und Männlein, dies sind meine ersten on-ear bluetooth Kopfhörer. Ich habe sehr lange überlegt welche ich mir holen soll. Ich bin wirklich keiner der pausenlos Musik hört oder auf perfekten Klang achtet. Diese Kopfhörer sind sehr gut verpackt angekommen und wirken Qualitativ ganz gut verarbeitet. Da ich wirklich sehr sehr schlechte on-ear kabelgebundene Kopfhörer mein Eigen nannte (die ich mal vor 10 Jahren gekauft hatte) bin ich vielleicht sogar die falsche Person die die äussere Qualität bewerten sollte. Jeder aber auch wirklich jeder neue Kopfhörer wäre qualität besser gewesen als mein alter Kopfhörer, da dieser schon mittlerweile auseinanderfiel. Dennoch muss ich sagen das der neue ""Sony WH-CH510W kabellose Kopfhörer"" mir äusserlich sehr gefällt. Ich habe es in grau geholt und es wirkt fehlerfrei bearbeitet. Die Polster sind sehr weich und angenehmm zu tragen. Wenn ich abends eine Serie schaue kann ich auch mal eine Std am Stück hören ohne das es drückt oder die Ohren wehtun. Achja mein Kopf ist nicht schmal sondern eher breit. Daher ...kein Problem. Was mir aber am besten gefällt ist die absolut lange Akkudauer. Stellt euch vor ihr kommt jeden Abend nach Hause und schaut eine 45 Minütige Serie und das macht ihr von Montag bis Sonntag...und am Sonntag wenn ihr das Ipad einschaltet und den Kopfhörer verbindet sagt es beim einschalten. ""Bluetooth connected. Battery fully charged."".....Sie sind immer noch voll ! Bei uns in der Familie läuft es so ab das zuätzlich zu mir auch noch meine Tochter täglich 30-60 Minuten ebenfalls den Kopfhörer nutzt. und dennoch ist der Kopfhörer Sonntags immer noch bei weit über 50%.Eher so 65 %. Also von mir aus hätte Sony ruhig noch 50 Gramm schwerer machen können und auf 80 Stunden erhöhen können. Wäre perfekt gewesen. :-) Diese Kopfhörer wackeln gar nicht und sitzen richtig gut. Sowohl bei mir als auch bei meiner 9 jährigen Tochter. Wir sind super zufrieden. Was den Klang angeht muss ich sagen das ich selten auf maximum höre aber bei 60% Lautstärke ist alles absolut klar und deutlich zu hören. Ein Rauschen gibt es für mich nicht. Und ich meine das meine Ohren wirklich gut sind. Ich wache schon öfters auf wenn eine Mücke im Nebenzimmer surrt. Aus meiner Sicht hat der Kopfhörer nach ca. 1 Monat bei mir zu Hause eine Kaufempfehlung verdient. 5 Sterne. Bewerten und abbonieren macht glücklich. Vielen Dank fürs lesen und Viele Grüße Öz"
292,"Bought the black version, for WFH, have some support calls. - First issue is the comfort, this is not comfortable at all. The cushion goes on top of your ears and hurts after a while. - The sound is nothing remarkable, noise cancelling is non-existent. Not that I was expecting something different for this price range. Now the real issues: - When having a call, I can hear my voice, the quality of the sound drops and it really makes very hard to understand what is going on. - The real reason I'm making this review is because now I tried with two machines (Windows and Mac) and I realised the device disconnects itself from the bluetooth randomly, is like the headphone restarts itself, disconnects from the bluetooth, tells me the battery and then connects again. This has happened three times in two different machines. Note that once this was IN THE MIDDLE OF A SUPPORT CALL. Hope this goes to the manufacturer."
293,Il est vraiment pratique 👌👌👍 j'adore 😍 il a l'air très solide .
294,"Vraiment confortable avec les commandes tactiles qui vous permettent d’augmenter / baisser le volume, changer de chanson et faire une pause. Excellente qualité et son. Ils ont divers embouts en caoutchouc pour s'adapter à différents types d'oreilles. La charge semble rapide et la durée de vie de la batterie est bonne. Je n'aurais pas pu trouver mieux : )"
295,"""J'ai en ma possession divers écouteur casque sony,bose, audiotechnica, jvc. Niveau son il manque peu être de basse ma la je compare bien sur avec des casques filaires beaucoup plus cher, on va dire que j'ai seulement 1 écouteur filaire bose et 1 casque bluetooth dans la gamme de prix de 80-100€ et le ils sont beaucoup moins bon au niveau de son. Si il y a une version plus cher avec un meilleur son je n’hésiterai pas a acheter. Niveau confort rien a redire dans mes oreilles les écouteurs ne bouge pas, parfait pour des oreilles de taille normal ma sœur n'a pas la mémé aisance avec ces écouteurs car je n'arrive pas a mettre les petits embouts. Je fais une session de running/art martiaux il n'est pas tombé. Vraiment facile lorsqu'on on a l'habitude, je conseil vivement de lire la notice, avec sa batterie de monstre cela presque une semaine que je l'utilise 1-2h par jours et il y a toujours 3 leds allumé. Pour conclure même si le nom de marque est un peu bizarre si vous n'avez pas de petites oreilles je recommande vraiment, un son équivalent a des bose soundtrue (même si pas la même signature), une très grosse batterie, avec un design assez bien réussis @@！###"
296,"Tout d’abord, mettez ces écouteurs dans une belle boîte pour les protéger. Le manuel est disponible en français et vous garantira que vous avez des doutes quant à son utilisation, mais en réalité, il est très facile à utiliser. Esthétiquement très élégant et discret, ergonomique, bien conservé. Les écouteurs ont une bonne autonomie, le contrôle par les boutons sur les écouteurs est efficace, et j’ai également testé les conversations téléphoniques, sans problème. La pleine charge est rapide et la durée de vie de la batterie peut atteindre plusieurs heures. Plusieurs pièces de rechange pour l’oreille dans la boîte peuvent offrir un confort optimal à de nombreuses personnes. Ils sont légers. L’entretien est parfait"
297,"Cette paire d'écouteur bluetooth est un véritable coup de coeur ! Elle possède une parfaite qualité de son, les basses sont géniales. C'est d'ailleurs la raison de mon coup de coeur. Elle est facile d'utilisation et très pratique: on peut changer de chanson, mettre en pause ou augmenter/baisser le son simplement en pressant les écouteurs. L'indicateur du niveau de batterie est très clair. D'ailleurs en parlant de batterie: elle est possède une grande autonomie. Je les utilise depuis 6 jours à raison d'1h par jour et ils n'ont toujours pas besoin d'être rechargé. Le maintien est topissime: les écouteurs ne bouge pas et son très confortables (testé lors de différentes activités telles que sport, ménage etc.). Certains se posent surement la question des lunettes: cela ne pose absolument aucun problème. Je porte moi même des lunettes, et c'est tout à fait confortable. Il suffit de bien positionner les écouteurs puis les lunettes. Donc n'hésitez pas à les acheter. En bref: un rapport qualité/prix plus qu'efficace, une qualité de son géniale, un confort et une autonomie assuré ! Foncez !"
