,0
151,Le sto usando sia per andare a correre che per andare in palestra e sono comodissime perché prendendo la forma dell'orecchio non si staccano ed è buona sia la qualità delle cuffie che del microfono perché faccio varie chiamate e mi sentono benissimo anche durante la corsa. Molto lunga la durata della batteria
152,"Buen producto, la batería me dura 3 días conectada al telobo para llamadas. La calidad de sonido es buena , no mete ruido y la otra persona te escucha muy bien. Trae varios adaptadores para el oído, esta muy bien y el imán es fuerte no se despeja fácilmente. Lo recomiendo"
153,Trovo che la qualità del suono di queste cuffiette non sia delle migliori ma per il prezzo che hanno non pretendevo molto. Ho trovato molto comodo poterle tenere al collo quando non le uso ed il fatto che grazie al magnete che hanno sul retro si attirino fra loro e mi tolgano il pensiero di poterle perdere. Oltre a sentire la musica le ho trovate comode per rispondere e parlare al cellulare e le porto sempre in borsetta chiuse in una mia sachettina (non ne vengono provviste) perchè occupano poco spazio. All'interno vengono fornite di filo per caricarle ma senza la parte che potete mettere nella presa. Se cercate qualcosa per sentire la musica non le consiglierei perchè non sono il top...ma se volete un paio di cuffiette da sfruttare per ogni evenienza e per rispondere alle chiamate senza troppo impegno potrebbero fare al caso vostro. Anna
154,"SONIDO PERFECTO, SE MUEVEN UN POCO AL CORRER, PERO CON LA ALMOHADILLAS DE RECAMBIO, SOLO HAY QUE ACERTAR CON EL TAMAÑO."
155,"Son muy cómodos, se adaptan perfectamente dentro de los oídos"
156,"Batería impresionante! Me duran unas 8 hs sin problema, cargan rápido, se adaptan bien a la oreja... Ideal para el gym!"
157,"Immediately I used these I could tell the difference between them and a more expensive pair of Sony ones I had bought at double the price but which kept falling out of my ears. I couldn't believe it. The Bass is sweet with these. Just beautiful. That is the most key thing for me, what I had been searching for for so long but at an affordable price. Also most importantly for me, the buds fit perfectly in my ear - I have small ears so this is usually a problem especially with the way some of these Bluetooth earphones are made, I don't need weird angles or wrap around things, just ones that go in and sit. And with these, the spiky thing is silicone and easily removed (which I did). I didn't even bother trying it with them on because...small ears. Needless to say I'm returning the Sony ones immediately. Everyone's reviews on these earphones helped me, so I thought it's only right that I should pass it forward :)"
158,"Me los pongo para el trabajo y aguantan todo el día. Calidad de sonido bastante buena para lo que es y se adaptan muy bien a la oreja, quedando bien cogidos."
159,"Ottimo prodotto. È la prima volta che ascolto, da un altro Smartphone, una voce cosi piena e intelleggibile, anche in vivavoce. Ho svariati prodotti AUKEY. Sono progettati veramente bene. Lavoro da 30 anni a Tokyo come responsabile di prodotto per un famoso brand di strumenti musicali e posso parlare con una certa esperienza. I progettisti e tutta la catena, lavorano con la testa e diligentemente. E i risultati si vedono"
160,"Apparairage rapide et efficace Se connecte automatique sur iPhone ou Android, pas de coupure. Simple d'utilisation, assez intuitif. Les écouteurs tiennent bien, c'est super pour courir avec, la plupart tombe et c'est assez agaçant et frustrant, mais pas la ! Bonne réduction de bruit, bon son et bonne autonomie. Écrin plutôt sympa et bien robuste, les oreillettes en charge et protégé Le kit main libre est plutôt pratique La lumière n'est pas présente après l'appairage donc ça fait pas trop cheap🥰"
161,"Dès la 1ère utilisation, un écouter ne fonctionnait pas. Je me suis dis qu'il fallait peut-être le charger correctement, du coup je le laisse charger la nuit. Le lendemain, il fonctionne parfaitement. N'étant pas une utilisatrice quotidienne, je le laisse de coté et le reprend quelques jour plus tard pour en rue et là, j'entends un message comme quoi, il faut recharger la batterie alors que je les avais utiliser 10 min auparavant. Bon soit, peut-être que les écouteurs se déchargent seuls même dans leur boite de charge ? Et là, quand je veux les recharger, l'un des deux écouteurs ne charge plus du tout :/ Etant donné que ça fait plus d'1 mois que j'ai acheté ce produit, je ne peux plus les retourner, je suis vraiment déçue !!"
162,Je les ai acheté pour regarder des films le soir pendant que mon mari dort a coter les autre ecouter que j avais n etait pas pratique car il tomber rapidement de mes oreilles et etait avec des fils. Ceux la reste bien en place quand je change de position et ya plusieurs taille d intra. ils sont tactile on peut monter et baisser le son facilement. Le son est net aucun grissilement ou autre. Facilement relié au smartphone grace au bluethoot. Le boitier est pratique car il charge automatique les ecouteur quand on les met dqns leurs emplacement et ya le pourcentage de batterie restant affiché.
163,"Les oreillettes sont très discrètes Elles tiennent vraiment bien dans les oreilles (même pour une séance de running) et sont vraiment confortables. Le boitier est très pratique. Lorsque vous avez fini de les utiliser, vous les remettez dans leur boitier et elle se charge alors toutes seules. Fini les galères lorsque vous partez faire une petite séance de course à pied et que vous avez une nouvelle fois oublié de mettre vos oreillettes à charger. Il faut bien sûr cependant de temps à temps penser à recharger le boitier via le mini-port USB niveau esthétique: ils sont très discrets"
164,"Apparairage simple rapide et efficace en 10 secondes, se connecte automatique sur smartphone Android, tiennent très bien dans les oreilles grâce aux différents embouts livrés avec (4 tailles). Pour les chargées c'est simple, vous rechargez la boîte qui sert de logement et le tour est joué, quand vous remettrez les écouteurs dans leur boîte, ils se rechargerons même s'ils ne sont pas reliées sur une prise. je les ai aussi appareiller sur mon téléviseur qui fait bluetooth. Fournis avec un cordon USB type C."
165,"Avant tout ce qui m'a impressioner vraiment dans ce produit c'est le design, les écouteurs elles sont super belle, même le boitier et la façon dont ce recharge avec un ecran LED qui indique le pourcentage du rechargement. Facile à la connecter en bluetooth sur votre smartphone, normalement compatible avec tout les bluetooth. Très bon confort au niveau des oreilles et stable ne tombent pas du tout, donc vous pouvez faire du sport avec, étanche imperméable à l'eau et la sueur, un microphone intégré pour vos appels téléphonique. Fonctionne par touch et un très bon rapport qualité/prix."
166,"Si vous cherchez des oreillettes très faciles à utiliser, de qualité très convenable à un tarif tout aussi convenable, celles-ci sont faites pour vous. Je mets 4 étoiles et non 5 car le son n'est pas excellent comparé à celui d'oreillettes plus onéreuses (mais enfin c'est tout à fait normal) mais surtout parce qu'elles n'ont pas une autonomie de 150h comme indiqué mais d'environ 12h (ce qui est déjà très bien)"
167,"Acheté le 20 Décembre 2019, a la poubelle le 11 Février 2020. L'écouteur a droite ne fonctionne déjà plus. Je vous conseille, de ne PAS acheter ce produit."
168,"These waterproof wireless Bluetooth 5 earbuds come in a great little portable charging case that can also be used as an emergency power bank for phones and other USB powered items. The case contains a 2200mAh battery which can charge each 85mAh earbud a total of 13 times. This will take up to 2.5 hours. A full charge will allow each earbud to be used for between 10 and twelve hours. The buds can also be used singly and you can even share your music by giving one to another person so long as you both stay within the 10m transmission range. The robust feeling case has a nice matt plastic finish, and there is an excellent LED display to show you the overall power level as well as that of each earpiece. Charging is by means of a USB-C type cable and a small one is provided along with differently sized ear tips and an easily understood manual. It is recommended to charge the case at least once every thirty days, and the port is protected by one of the best rubber seals that I have yet come across. As soon as you open the lid, the ear buds automatically pair with each other and this is confirmed by a small beep and by the coloured circles becoming a steady blue. Pairing was very easy. I simply opened the case, went to the Bluetooth section on by phone and selected 'F9' to complete the process in under thirty seconds. As my ears have been working hard for over sixty years, I can only state that I found all the music/sound and monologue files that I tested were very impressive and that the vast majority of background noise was excluded to give a very enjoyable and comfortable listening experience. I can't comment on the other mobile telephone functions as I simply do not make use if them. My only slight difficulty was in removing and replacing the earbuds in the case, but that will come with confidence and practice. All in all, I am delighted with this set."
169,I am super impressed by this. Firstly it only needs to connect once to my iPhone. Then it was a matter placing my ear and it’s connected. The battery case is great it can charge your phone if necessary. But rarely use it for that. Mainly it lengthens the battery capacity of the headphones. They can work independently or together. Which is the problem with other one I have tried. The case looks good but the headphones look great. They are responsive to touch when in ear. I’m impressed and would recommend all day long.
170,"Valen cada euro que me he gastado en ellos, buenos no, lo siguiente...Aunque para correr no me valen mucho porque al trotar y respirar todo el rato con la boca abierta se me cierra el pabellón auditivo y apenas oigo la música, estoy mal hecha qué vamos a hacer...por otro lado utilizarlos fuera de este caso ha sido una experiencia de lujo porque suenan muy bien, no sabría decir, los graves son profundos y los agudos muy claros, eso sí, estoy utilizando un software en mi Smartphone para escuchar música que flipas. Por cierto, el emparejamiento lo hice a la primera, sin complicaciones de nada. Otro punto es que aislan muy bien del ruido exterior, y en el metro o en el bullicio de la calle no se escucha nada de nada de fondo, no se corta la transmisión, no se escuchan chasquidos ni ostias raras, sólo un sonido limpio. Otra flipada es la autonomía, una salvajada de horas tanto en los cascos como en la cajita de guardado donde por cierto podemos ver la carga restante aproximada de forma porcentual, esto en principio fue lo que me hizo decantarme por los cascos pero luego te das cuenta que también te lo marca en el mismo smartphone. Ah! Que puedas utilizar la caja como una power bank pues está bien pero tampoco es algo que vaya a utilizar pero si alguna vez te quedas tirada pues bueno... No sé qué más decir que no se pueda leer, lo que aguanta el sudor y todo eso es cierto y que son cómodos también porque no pesan nada. En fin... Encantada con la compra, chin-pom!!!"
171,"Cuando los compré la verdad no esperaba que fueran buenos, he comprado otros y la verdad que he tenido bastante malas experiencias. Pero con estos estoy realmente sorprendido, principalmente en cuanto a calidad de sonido, nada que envidiar a auriculares de mucho mayor precio. En cuanto a la batería me aguantan bien más de 10 horas, los uso para entrenar en el gimnasio y me duran todo el entrenamiento y el viaje de ida y vuelta que en total serán 3 horas o más, al meterlos en la caja están en torno al 70% de carga por lo que deben aguantar aún más. El estuche de carga es de 2200 mAh para lo que te da para varias cargas, según el fabricante para 156 horas, que serían unas 15 cargas, la verdad que nunca me he quedado sin batería en ellos ni creo que pase. Además tienen muy buenos acabados y el táctil funciona muy bien: un toque play/pausa, dos toques siguiente/anterior, lo dejas pulsado para subir y bajar volumen, además funcionan con siri y el asistente de google. Sin duda por el precio que tienen no puedes obtener nada mejor."
172,"Buscaba unos auriculares que fueran de buena calidad y que no me subieran tanto de precio como algunos de marcas más conocidas ya que eran para un regalo y buscando encontré estos, me convenció su diseño moderno y vistoso así que me decidí a comprarlos. No me han defraudado en absoluto, al abrir la caja se emparejan y te muestran en números el porcentaje de carga restante, pero sin duda su punto a favor es que sirve también como batería externa para cargar el teléfono o cualquier otro dispositivo. Aunque para mi lo mejor de todo es que son los primeros que veo que funcionan con cable usb tipo c (como la mayoría de smartphones hoy en día) y evitan tener que cargar con dos cables. Aún no he hecho el regalo, pero estoy segura de que la persona que lo ha de recibir quedará encantada."
173,Son bastante buenos en cuanto a materiales y a calidad de sonido. Es un punto que te diga el porcentaje de batería de cada auricular. Y puedes cargar el teléfono con él so te quedas sin batería. Muy recomendable!
174,"Los compre para hacer un regalo, es una persona que hace mucho deporte y siempre llevaba encima cascos con cable. Estos son mucho más cómodos para hacer deporte, el diseño es muy innovador y se adaptan muy bien al oído. Me ha encantado que incluya en la caja el indicador de batería fe cada auricular ( es algo que no había visto en otros). La conexión bastante buena, sin problemas se conecta y se escucha perfectamente (buena calidad de sonido) Lo bueno es que no cuestan tanto como los archiconocidos earphones de Apple, y no tienen nada que ver envidiarles."
175,"Los auriculares me han parecido un acierto, se escuchan perfectamente tanto las llamadas del móvil como la música, la música se oye muy nítida y la potencia del sonido es muy buena, son muy cómodos y fáciles de poner con el móvil, y que en la caja donde guardarlos ponga la carga que tienen cada uno me parece genial puesto que con los otros que tenía se me quedaban sin batería al no saber la carga muchas veces en medio de una carrera y eso fastidia mucho, además sin resistentes al agua con lo que estoy duchando con ellos y sin problemas e incluso he contestado llamadas en la misma ducha un acierto una compra con la que estoy súper contenta"
176,"Solo los utilizo en mi mp4, móvil y tv para escuchar música y tiene una muy buena calidad de sonido. El emparejamiento con estos 3 dispositivos es rápida y sin problemas y simplemente hay que levantar la tapa de la caja para que se conecten. Ademas en la escucha no se producen cortes de sonido. No he calculado el tiempo de que duran sin cargan ya que cuando acabo de usarlos los meto en el estuche y se vuelven a cargar. Una de las cosas que mas me gustan es la pantalla led donde puedes comprobar la carga de los auriculares. Lo que menos me gusta es el control táctil."
177,"Well, not quite, but yesterday in the rain was the sponsored walk for the local cat rescue team and it was also my conference call with the Chinese Management team of my brother's company; therefore I needed to not only to listen to my favorite shows to avoid the chit chat of the boring people on the walk, but at the latter stages take some important phone calls. These excellent earbuds, fit good so they won't become uncomfortable over a long period of time, cancel noise so I get less of the chit chat from others and also provide excellent clarity for calls. Get yourself a pair."
178,"Für den Preis tolle Teile. Am Anfang war ich allerdings kurz davor die Ohrhörer wieder zurück zu senden. So wie hier in wenigen negativen Bewertungen zu lesen, waren sie extrem Basslastig. Tat richtig weh auf die Ohren und ich war erstaunt, wie solch kleine Dinger wummern können. Player auf dem Smartphone war der Mortplayer. Auch mit verschiedenen Equalizer Einstellungen des Players wurde das nicht besser. Durch Zufall startete ungewollt später der ebenfalls vorhandene VLC Player. Plötzlich hörte ich das ganze Gegenteil. Keine Bässe mehr, dafür hell und blechern. Auch das steht in einigen negativen Bewertungen. Daraufhin probierte ich, neugierig geworden, einige andere Player aus. Und siehe da, der Phonograph Player sorgte für einen Spitzenklang. Der nutzt allerdings den Android9 eigenen Equalizer und damit kann man den Klang perfekt einstellen. Dazu noch Dolby Atmos aktivieren und staunen. Kein Unterschied zu meinen gewohnten Philips Ohrhörern mehr. Wer also hier Probleme hat sollte ruhig mal mit verschiedenen Playern spielen. Es liegt garantiert nicht an den Ohrhören. Eher an Player oder Smartphone. Auch die Bluetooth Verbindung ist äußerst stabil, das Pairing geht schnell und zuverlässig. Ich hatte die Teile jetzt zwei Tage über jeweils 8 Stunden in Betrieb und nicht einen Aussetzer der Verbindung und auch kein Stottern der Musik. Auch hier kein Unterschied zu den gewohnten kabelgebundenen Hörern. Telefonfunktion ist gut - kann man gut als Freisprechanlage nutzen. Man versteht den Telefonpartner gut und wird auch gut verstanden. Naja, und die Akkus hielten auch satte 11 Stunden durch. Bisher kann ich nichts negatives feststellen. Lernen muss man allerdings die verschiedenen Touchfunktionen. Ich löse zurzeit meist noch das falsche aus."
179,"Me he decantado por estos auriculares y a continuación mencionaré porqué tras un mes de usarlos Cosas buenas a mencionar: - El sonido me parece que está bastante bien, buenos graves y agudos, aunque si se quiere mejorar aún más existen aplicaciones para ajustarlo. - La duración de la bateria del estuche es larguísima, uso los cascos como poco unas 4 horas al día y con cargar el estuche al máximo una vez puede llegar a durar la batería más de 3 semanas, algo exagerado, pero increíblemente útil y estoy encantado con esto. Sirve para sacarte de un apuro por si no tienes batería en el movil y necesitas cargarlo, pero no usaría el estuche como batería externa para el movil. De momento la tapa se abre y se cierra perfectamente así que no tengo pegas en cuanto a esto. - El sistema de pasar de canción, pausa, subir y bajar volumen funciona perfectamente, precisamente escogí estos auriculares por esas características. No he llegado a hablar con ellos así que no mencionare nada de eso, tendría que probarlo. - Algunas personas han comentado que les parecen grandes los auriculares y la caja. La caja de hecho si es bastante grande, abulta si lo llevas en el bolsillo, los auriculares creo que tiene un tamaño normal. No me parece un inconveniente ya que abulte un poco me da igual. Cosas malas o contras: - Las gomitas o almohadillas que vienen con los auriculares no están bien diseñadas, no aíslan del ruido exterior y al entrar en el oído se siente raro, se nota presión, no se oye bien el sonido y pueden resbalar, no encajar o salir del oido. Solución: he sustituido las almohadillas por otras que si se adaptan perfectamente al oído, no resbalan y son cómodas, con éstas los auriculares mejoran en gran medida y la música se oye mucho mejor, lo malo es que estás almohadillas puestas en los auriculares no encajan en el agujero del estuche y no cargan, con lo que tengo que sacar las almohadillas al meter los auriculares en el estuche y volver a ponerlas cada vez que vaya a usar los auriculares. En resumen, son unos buenos auriculares, a excepción de las almohadillas que se soluciona cambiandolas por otras"
180,Auriculares conectividad bluetooth que se recargan automáticamente al guardarlos en su estuche. Lo más destacado y por lo tanto lo que más me ha gustado es: -La inmejorable conectividad de la que dispone gracias a su conexión bluetooth 5.0 -El estuche sirve para cargar los mismos auriculares incluso debido a su banco de carga tambien permite recargar el movil. -Tiene un sonido de bastante calidad. - Son 100% impermeables siendo usados mientras corría y no han sufrido ningún defecto -la forma que tienen son bastante cómodos. - la autonomía es bastante buena siempre y cuando el volumen sea el adecuado como todo. -Su uso es bastante sencillo -el estuche cargador dispone de una pantalla led que indica la batería de cada casco y el porcentaje de carga de la batería que dispone El artículo es bastante bueno para el precio que tiene.
181,"Despues de usarlos a fondo durante tres dias ,dandoles caña y probando todas sus funciones ya puedo decir que son los mejores auriculares inalambricos que e probado.La calidad de sonido es muy buena,los bajos y agudos estan muy equilibrados ofreciendo así un sonido claro y limpio,la potencia es la leche ya a la mitad se oyen de sobra pero vas subiendo el volumen y al llegar al maximo casi no se puede aguantar de la potencia que tienen sin perder calidad de sonido.Son muy comodos no te das cuenta de que los llevas puestos porque pesan muy poquito.En cuanto a la bateria es increible; despues de usarlos siete horas seguidas sin parar los puse a cargar y aun le quedaban media carga de bateria creo que aproximadamente puedes tener carga para unas 13 o 14 horas sin parar,luego a la hora de cargarlos en una hora mas o menos los tienes cargados.Lo que si me gusta mucho es que la caja de carga tambien es una power bank es decir que puedes cargar el movil usando la carga de la caja.En cuanto a la presentacion es una pasada viene un display digital con la carga que le queda a la caja y con la carga que le queda a cada auricular,le aporta un toque de calidad tremendo.La conexion con el movil es tan sencilla como abrir la caja por primera vez se emparejan los auriculares entre si solos y nada mas que tienes que abrir el bluetooth en tu movil y vincularlo con los auriculares,ya para las siguientes veces que los uses al abrir la caja se vinculan automaticamente.A la hora de cargarlos solamente es quitartelos y meterlos en la caja se iluminaran en azul y empezaran a cargar,cuando esten cargados se iluminaran en verde y se apagan ellos solos.En resumen una compra fantastica si quieres unos auriculares de muy buen sonido, bastante potencia y una muy buena bateria, todo ello por un buen precio."
182,"I was wanting a pair of bluetooth earphones but with so many products available and also being aware of so many fake reviews on Amazon asked my colleagues opinion on his recently purchased ones. Got to say I am glad I did . These are excellent for price set up was easy, sound is immaculate. Charge lasts for ages. When I got them they had 85% charge got to say it took a while to charge them up to full initially probably around 90 minutes but now been using them a week and the charge has not dropped . I would imagine might take them 4-5 hours to charge from low to full but appears will take months before they need charged so I will accept that. Only criticisms is part of the reason I bought them was because I plan on buying a smart watch and wanted earphones to use it when running, they have fallen out a couple of times so personally wouldn't trust them if I was running. An other minus point is they connect immediately to your phones music app when you take them out box so you end up listening to first few bars of the last song you listened to every single time you put them in this gets old very quickly. They are also incredibly sensitive so you try to adjust them to get more comfortable and the sound goes off or another song comes on or it stops the tv show you are watching and starts playing music. Hopefully user error/teething problems though and overall pleased with my buy"
183,"Juste Whaou ! Incroyablement surpris par ces écouteurs, vu le prix je m'attendais à quelque chose de basique mais c'était une très belle surprise ! Tout d'abord l'emballage : soigné et rassurant, tout est bien présenté dans la boîte et tout est là (mode d'emploi, guide d'utilisation rapide ainsi qu'une carte à activée pour étendre la garantie à un an). Le matériel : aucun défaut visible, fabrication soignée et semble résistants. La boîte comprends donc les écouteurs, le boîtier de rechargement, une boîte en carton comprenant différents embouts (s,m,l,xl), un câble micro USB et une lanière à accrocher si besoin au boîtier de rechargement. La qualité de son : très grosse surprise ! Sincèrement je m'attendais à quelque chose de correct mais pas à ce point la, des basses profondes qui cognent, des aigus très bien restitué et aucun grésillement perçu même à fond (RIP mes oreilles d'ailleurs). Pour finir, le confort : et bien surprise aussi, bien que la première utilisation soit un peu bizarre, le poid n'est pas du tout inconfortable, les embouts en revanche aurons besoin d'un peu d'utilisation pour ce ''modeler'' avant d'être vraiment agréable. Pour conclure, des écouteurs au rapport qualité/prix exceptionnel qui n'ont rien à envier aux fameux ear buds de la marque à la pomme... Je recommande donc vivement ! Léo."
184,Positif: Super écouteurs / Beau design / Son de qualité et bonnes basses / Facile d'utilisation / S'adapte à toute oreille / Négatif: Utiliser le boitier uniquement pour recharger les écouteurs et non pas pour les stocker autrement les écouteurs vont vider la batterie du boitier en moins d'une semaine de non-utilisation /
