,0
0,"J'ai acheté cette paire d'écouteurs car j'ai été surpris et charmé par l'apparence du boîtier sous forme d'écrin d'apparence ""cuir"" et des écouteurs de la marque bien connue Aukey ! La grande nouveauté par rapport à la concurrence, c'est la mousse à mémoire de forme comme embout sur les écouteurs, c'est très agréable, un peu perturbant au début mais on s'y fait vite! Ça change vraiment de ce que je peux connaître d'habitude! Le contrôle sur les écouteurs est tactile et le microphone Intégré est efficace ! Les basses sont plutôt bonnes, c'est appréciable et le maintien dans l'oreille est bon. Je recommande. J'espère que ce commentaire vous a été utile."
1,"elles sont très pratiques et confortables, elles tiennent très bien dans l'oreille. Je suis très surprise de leur batterie, elles tiennent 4h et leur boîte de chargement tient 12h. J'avais peur que cela soit trop peu, mais dans la réalité je me retrouve très rarement à devoir les charger. Je me contente de les mettre dans leur étui une fois par jour pendant ma pause déjeuner, et je n'ai jamais de problème de batterie. Pas de perte de connexion entre plusieurs écoutes. Facile de rangement grâce à la petite taille du boitier de recharge. Une pression sur l'écouteur permet de mettre sur stop la musique et une nouvelle pression permet la reprise. Il y a aussi la possibilité de n'avoir qu'un écouteur de fonctionnel pendant que l'autre ce trouve dans la boîte."
2,La livraison était très rapide Qualité du son 90% Confort 95% Sound isolation (réduction du bruit) 100% Qualité prix 100% Design 100% Très facile à utiliser Il fait voir le pourcentage de batterie sur le portable
3,"Simple d'utilisation et connexion rapide. Le son est parfait pour écouter de la musique ou passer des appels. La batterie tient plusieurs jours avec écoute prolongé. Petit plus, port très confortable avec les embouts en mousse !"
4,"Faites l'achat pour mon fils, car avec l'accouchement, il avait besoin d'eux pour suivre des cours. Au final, l'achat m'a paru meilleur que prévu. La qualité de l'étui est très bonne, elle a une finition fine et élégante (comme si c'était du cuir). Il a une bande élastique qui peut être placée / attachée presque n'importe où. Ce que j'ai le plus aimé, c'est la façon dont il s'adapte à l'oreille, créant un environnement d'annulation du son parfait. Il dispose également de 3 embouts en silicone de 3 tailles différentes. L'ordinateur est livré avec son câble USB pour la recharge. J'ai couru plusieurs fois avec eux et je n'ai pas eu de problème, ils sont bien ajustés. Livré avec une garantie de 24 mois"
5,"Toujours ravi par cette marque, bonne fabrication et belle finition , ce connect facilement, le son est clair, très simple et efficace."
6,"J'avais envie d'essayer les écouteurs sans fils du style airpods car mon nouveau gsm, le Samsung galaxy note 10 plus n'a pas de prise Jack, j'ai donc acheté ces écouteurs et après plusieurs jours d'utilisation, j'en suis tout simplement fan, ils sont faciles à utiliser, une fois appairer, ils se connectent automatiquement à mon GSM dès que je les sors de leur boîte. L'autonomie est excellente, ils sont puissants et ils tiennent bien dans mon oreille."
7,"Très bons écouteurs confortables, assez légers on les sent à peine, bonne isolation du bruit extérieur pour le prix, qualité du son exceptionnelle étant une adepte de Bose et des casques à réduction de bruit. D’autres marques au même prix sont bien moins confortables et trop dans les aigus avec une isolation extérieur proche de zéro. Je l’utilise surtout pour regarder des films sur iPad ou écouter la musique pas de décalage noté pour les films. Le son n’est juste pas réglable lorsque les écouteurs sont connectés à un Mac mais très bon son et pas de décalage non plus. Contente de cet achat."
8,"Appena mi sono arrivate, non ho resistito nel provarle e recensirle immediatamente. In generale, nella mia pregressa esperienza, Mi sono imbattuto in cuffie bluetooth di bassa qualità e prezzo anche abbastanza elevato (35-45€) ma mi sono subito reso conto che si trattava della solita cinesata che su siti cinesi trovi a 4/5 dollari (non so se avete presente le cuffie con il fulmine e le impronte digitali colorate in verde/celeste...). Un mio amico runner mi ha consigliato di acquistare queste cuffie bluetooth perché lui si stava trovando egregiamente. Ho seguito il suo consiglio e ad oggi ritengo di essere estremamente soddisfatto, per i seguenti motivi: 1) la qualità del suono è impressionante (al pari delle air pods) 2) la qualità delle chiamate mi ha veramente stupito. Questo infatti è l'aspetto più critico perché finora ho beccato solo fregature. Con queste cuffie la qualità della chiamata è assicurata (si avvicina alla qualità degli Air Pods che in tale settore, secondo me, sono imbattibili) 3) Durata eccellente perché garantisco un buon mix di autonomia tra ascolto musica e chiamate (le ho stressate parecchio e hanno una durata di circa 5/6 ore). 4) nella confezione sono presenti diverse taglie di cuscinetti per orecchie (S/M/L/XL) e quindi sono adattabili perfettamente; 5) il bluetooth è straordinariamente potente poiché ho provato ad allontanarmi dallo smartphone di almeno 25 metri e il segnale era chiaro e forte; In definitiva, state tranquilli non è la solita cinesata. È un prodotto di qualità! #Joseph#"
9,"Ancora una volta i prodotti della AUKEY si dimostrano perfetti ed affidabili. Ho usato queste cuffie Bluetooth per diversi giorni e devo dire che il suono risulta pulito e cristallino, i bassi si sentono bene e sono soddisfacenti quando si ascolta della musica. Li ho provati anche durante delle chiamate; il suono in arrivo risultava preciso e puntuale (senza ritardi) e così anche il mio interlocutore non ha avuto problemi a capire ciò che dicessi. Sono un ottimo prodotto e le consiglio a chiunque voglia delle ottime cuffie Bluetooth. La confezione contiene, oltre alle cuffie: - custodia di ricarica (le cuffie si possono caricare solo all'interno della custodia); - cavo di ricarica (micro usb); - gommini sostitutivi per le cuffie (taglia piccola e grande rispetto a quelle medie che escono di base)."
10,"Le cuffie Aukey rispecchiano perfettamente la descrizione ed il pacco è arrivato in anticipo di una settimana. Più nel dettaglio: -Le cuffie Wireless sono maneggevoli, piccole, discrete e touch (non hanno pulsanti). -Arrivano in un pacchetto contenente un libretto di istruzione in 5 lingue diverse; una ""Quick start guide""; Garanzia di 24 mesi; 3 paia di gommini di diverse dimensioni ( S, M, L) per adattarsi meglio al padiglione auricolare e non cadono facendo esercizio fisico; cavetto per ricaricare con uscita USB. -Sono semplicissime da usare: è necessario accendere il Bluetooth dello smartphone (o altro dispositivo), fare la ricerca e collegare gli auricolari. Questi si accendono con un tocco leggero per due secondi. -Il case (la custodia) si ricarica completamente in 2h e permette di caricare le cuffie circa 4 - 5 volte. -Inoltre, io ho uno smartphone Xiaomi e sono compatibili nonostante non sia scritto in descrizione. Comodissime."
11,"Arrivate con un giorno di anticipo rispetto alla consegna programmata tramite corriere Amazon, il prodotto rispecchia la descrizione del venditore. Le recensisco dopo una settimana di utilizzo e le trovo molto comode, sia per ascoltare musica in quell'ora di esercizi casalinghi per tenersi in forma in questo periodo, sia nel parlare al telefono. Nel consueto pacchetto/scatolina Aukey marrone troviamo il case elegantissimo che a primo impatto sembra fatto di pelle nera, con all'interno i due auricolari marchiati Aukey, il cavetto per ricaricare, 3 paia di gommini per tutte le tipologie di orecchie e l'immancabile libretto di istruzioni. Come già detto sono molto comode e durevoli in più il suono esce limpido e potente e le conversazioni non risentono dei consueti fruscii che altre tipologie di auricolari hanno. Dopo il primo accoppiamento in cui come sempre dobbiamo effettuare la ricerca tramite bluetooth del nostro smartphone, le cuffie, ai successivi utilizzi, andranno a ricercare in automatico il nostro telefono e si collegheranno in semplicità. Facilissimo il trasporto."
12,"Queste cuffiette sono a dir poco strepitose . Comprate a 31.99 invece di 39.99 , la marca Aukey è una garanzia . Innanzitutto la custodia è molto particolare, sembra fatta in pelle. Il tempo di ricarica completa della custodia è di circa 2 ore e si riescono a caricare anche 4 volte gli auricolari. Il peso complessivo è di 68 gr,leggerissimo. Gli auricolari hanno degli indicatori LED , rosso ,bianco ,lampeggiante . Il suono è perfetto, anche a 8 metri di distanza non ho avuto problemi . Avevo altre cuffiette aukey , regalate successivamente alla mia famiglia, non sceglierò mai un'altra marca perché penso che questa sia la migliore in questo campo. Le consiglio"
13,"Non è la prima volta che acquisto qualche prodotto di elettronica da Aukey e anche stavolta non sono rimasto deluso! Le cuffiette arrivano in una confezione di cartone semplice ma ben progettata. Nella scatola, oltre alle cuffiette con la loro custodia, troverete un cavetto di ricarica e tre paia di gommini di dimensioni diverse. Utilizzo i medi e vanno benissimo, le cuffie restano ferme e sono comodo da usare. La custodia è piccolina e carina e consente di ricaricare le cuffiette per 4-5 volte circa. L'audio è ottimo, i suoni sono puliti e i bassi presenti. Si accoppiano subito con lo smartphone e mantengono bene la connessione. Le cuffie sono touch e, parere personale, presentano uno stile moderno e semplice molto gradevole. Al prezzo di offerta a cui le ho trovate sono davvero un ottimo acquisto. Compratele e non ve ne pentirete!"
14,"Acquisto spesso delle cuffie wireless per fare i regali ai miei nipoti, ma anche perché mi piace ascoltare la musica e ne tengo un paio praticamente ovunque. Siccome ne provo molte posso garantirvi che le Aukey sono sempre le migliori come rapporto qualità prezzo. Le confezioni sono sempre ben curate, il cofanetto di queste è morbido, sembra pelle. Le cuffiette sono piccole e leggerissime, stanno molto bene nell'orecchio e hanno un ottima qualità del suono! I bassi non sono fastidiosi, e gli alti anche se di mette il volume al massimo, non gracchiano! Il volume totale non è da ""spacca timpano"", ma comunque la musica è molto alta. Sulle cuffie è presente un tasto touch, quindi non cliccabile, ma sensibile al tocco. Toccando una volta si stoppa la musica, toccano due volte si manda avanti la canzone (con il destro) o indietro la canzone (con il sinistro). Io non ho trovato il modo di regolare il volume dalla cuffie è l'unico difetto che ho trovato. Il cofanetto ha la ricarica micro USB, e avrei preferito una tipo C di ultima generazione. In chiamata si sentono bene e il nostro interlocutore non ha se fruscii e ne suoni fastidiosi. Io le consiglio...anche perché Aukey è veramente un ottima marca come rapporto qualità prezzo!"
15,"Le uso da circa una settimana e devo dire che ne sono rimasto davvero soddisfatto, ottime per le telefonate. I rumori di fondo sono filtrati in modo adeguato. Consiglio l'acquisto."
16,"Motivi per cui acquistare queste cuffie: 1) la qualità del suono è molto buona 2) si riescono a fare chiamate di buona qualità 3) Durata della batteria veramente eccellente (le ho stressate parecchio e hanno una durata di circa 5/6 ore). 4) nella confezione sono presenti diverse taglie di cuscinetti per orecchie e quindi sono adattabili. 5) il bluetooth prende fino a 15 metri In definitiva, state tranquilli è un prodotto di qualità e ha un buon rapporto qualità prezzo"
17,"Oramai, dopo quasi una mezza dozzina di cuffiette wireless comprate e puntualmente requisite dalle mie figlie, sono diventate un esperto di cuffiette senza fili e tra le quelle più pratiche, longeve a livello di vita di batteria e dotate di grande qualità, le cuffiette senza fili di Aukey sono il classico modello alternativo che non ti aspetti. A fronte di una custodia un po’ piccolina e quindi di una batteria di ricarica non molto grande, sull'altro piatto della bilancia ho trovato una qualità sorprendente sia in ascolto sia in conversazione e un comfort estremamente comodo. Sono molto buone anche per l'isolamento che permette di usarle in treno senza dover alzare troppo il volume. Solo 2 consigli, per chi decide di acquistarle: 1. bisogna sistemarle bene nell'orecchio, pena una perdita drammatica delle frequenze basse (errore che io ho fatto nei primi giorni di utilizzo, durante i quali mi sembravano suonare malissimo e ""stridenti"") 2. necessitano di qualche giorno di rodaggio, prima di esprimersi al meglio (io ho notato dei miglioramenti dopo circa 1 settimana di utilizzo). Ottimo il reparto del microfono, ma veniamo alla parte che interessa di più per un'eventuale acquisto: l'audio. Devo dire che il suono che esce da queste cuffiette Aukey è molto pulito ed in generale buono su tutte le frequenze. Per quanto mi riguarda un po’ carente sui toni gravi ma si sa, questo fa parte delle preferenze personali. L’audio con le chiamate telefoniche è ottimo, senza interruzioni, distorsioni. La custodia, come per tanti modelli in commercio è un power bank, oltre ad essere il caricatore. Un volta effettuata un ricarica completa, consente di aumentare molto la durata della carica delle cuffiette, semplicemente riponendole al suo interno. Il rapporto qualità prezzo lo trovo eccellente, per delle cuffie auricolari total wireless. Importante per tutti noi è che questi ottimi auricolari bluetooth sono venduti su Amazon, pertanto godono di tutta la garanzia verso il cliente, che da sempre contraddistingue Amazon, mi sento pienamente fiducioso di consigliarne l’acquisto."
18,"Uno spettacolo, Aukey non mi delude mai! i miei precedenti auricolari hanno deciso di fare un giro in lavatrice e ho dovuto trovare un degno sostituto perché, lavorando in ufficio, non posso farne a meno. Non avendo alcuna intenzione di ricomprare le Air pods visto il loro costo, ho scelto inizialmente diversi modelli di cuffie bluetooth economiche, fino a scegliere queste dopo diversi tentativi. Sono super soddisfatta dell'acquisto, perché posso dire di aver trovato una qualità sonora che eguaglia gli Airpods. Finalmente delle cuffie economiche con bassi decenti e un suono non tendente agli alti. in chiamata sono chiari e l'interlocutore riceve un segnale pulito, mi hanno anche detto che vengono piuttosto isolati rumori ambientali dell'ufficio. I comandi touch sono piuttosto intuitivi e reattivi E con questi è possibile avere il controllo di tutto, dalle chiamate alla musica. Il case piccole discreto e consente diverse ricariche. Per il prezzo pagato sono un vero best buy per chi cerca delle cuffie con una qualità sonora ottima."
19,Conosco e pratico da poco questa marca. Devo dire che mi ha piacevolmente sorpreso. Buono il rapporto qualità prezzo. Le cuffie hanno una buona resa audio ed isolano bene dai rumori esterni. Basetta di ricarica testata per 3 ricariche piene. I due auricolari si posso anche utilizzare separatamente associndoli a due dispositivi diversi. Velocissime nell'accoppiamemto con dispositivi bluetooth. Il volume massimo rimane un po' basso me è una questione soggettiva. Tutto sommato un buon prodotto.
20,"🔝 Inizierei con il dire che Aukey è sempre una garanzia, e anche in questo caso non si è smentita! La qualità di questi auricolari è veramente ottima e l'isolamento acustico molto elevato. 🔝 📦 CONFEZIONE: La confezione è minimal e senza fronzoli e contiene - Case di ricarica con all'interno gli auricolari - Cavo di ricarica (micro-usb) - Gommini di ricambio di diverse dimensioni (3 misure) - Manuale d'uso rapido e garanzia 🔊 AUDIO: Ottima la riproduzione delle medie frequenze, bassi profondi e alti di buona qualità. Anche la qualità delle chiamate è assolutamente convincente con un suono chiaro per entrambi gli interlocutori. ✅ PRO: - Ottima qualità del suono - Connessione blue-tooth stabile - Possibilità di utilizzare anche un solo auricolare lasciando l'altro nel case - Funzioni touch semplici e precise - Buon audio in chiamata ❌ CONTRO: - Non ho rilevato alcun difetto importante, unico neo assolutamente trascurabile è che utilizzando un solo auricolare la funzione di avanzamento/retrocessione traccia è limitato. 💰RAPPORTO QUALITÀ/PREZZO: Ottimo 🚚 SPEDIZIONE: Sempre 🔝 grazie ad Amazon"
21,"Ho acquistato prodotti AUKEY sempre in serenità, consapevole della validità di questa marca. Dopo caricabatterie, power bank e cavetti in generale, ho voluto acquistare questo paio di auricolari Bluetooth poichè sono un appassionato di oggetti di questo genere e cercavo qualcosa di valido da poter accoppiare alla mia Fire Stick. Gli auricolari sono belli da vedere, comodi da indossare e hanno un'equalizzazione veramente strepitosa: bassi potenti e alti cristallini, mentre i medi risultano un pò sovrastati dai bassi. Un difetto di questi auricolari è che non permettono di regolare il volume con il tap su di essi, ma solo tramite il dispositivo a cui sono collegati. Il volume massimo è insopportabile, ovvero, suonano veramente forte! Difficilmente le adopererete al massimo. La confezione è di buona fattura, di plastica con una trama che sembra di pelle, i gommini di ricambio (in 3 misure) sono i soliti di questa categoria ma quelli montati sono di un materiale espansivo che ne risalta l'isolamento acustico passivo. Sono stracontento dell'acquisto e ve li consiglio anche per guardare la tv. Infatti accoppiati con la mia Fire stick 4k suonano benissimo."
22,Le cuffie si presentano in una confezione molto smart. Confrontandole con altre acquistate in precedenza ho apprezzato molto la compattezza della custodia che fa anche da box ricarica. La qualità dei materiali è alta così come il suono e la qualità in chiamata. Essendo blueooth 5.0 è possibile collegare anche 2 dispositivi contemporaneamente. In termini di durata con utilizzo frequente di 5/6 ore al giorno durano 2 giorni. In conclusione direi che è un acquisto perfetto.
23,"Vraiment confortable avec les commandes tactiles qui vous permettent d’augmenter / baisser le volume, changer de chanson et faire une pause. Excellente qualité et son. Ils ont divers embouts en caoutchouc pour s'adapter à différents types d'oreilles. La charge semble rapide et la durée de vie de la batterie est bonne. Je n'aurais pas pu trouver mieux : )"
24,"""J'ai en ma possession divers écouteur casque sony,bose, audiotechnica, jvc. Niveau son il manque peu être de basse ma la je compare bien sur avec des casques filaires beaucoup plus cher, on va dire que j'ai seulement 1 écouteur filaire bose et 1 casque bluetooth dans la gamme de prix de 80-100€ et le ils sont beaucoup moins bon au niveau de son. Si il y a une version plus cher avec un meilleur son je n’hésiterai pas a acheter. Niveau confort rien a redire dans mes oreilles les écouteurs ne bouge pas, parfait pour des oreilles de taille normal ma sœur n'a pas la mémé aisance avec ces écouteurs car je n'arrive pas a mettre les petits embouts. Je fais une session de running/art martiaux il n'est pas tombé. Vraiment facile lorsqu'on on a l'habitude, je conseil vivement de lire la notice, avec sa batterie de monstre cela presque une semaine que je l'utilise 1-2h par jours et il y a toujours 3 leds allumé. Pour conclure même si le nom de marque est un peu bizarre si vous n'avez pas de petites oreilles je recommande vraiment, un son équivalent a des bose soundtrue (même si pas la même signature), une très grosse batterie, avec un design assez bien réussis @@！###"
25,"Tout d’abord, mettez ces écouteurs dans une belle boîte pour les protéger. Le manuel est disponible en français et vous garantira que vous avez des doutes quant à son utilisation, mais en réalité, il est très facile à utiliser. Esthétiquement très élégant et discret, ergonomique, bien conservé. Les écouteurs ont une bonne autonomie, le contrôle par les boutons sur les écouteurs est efficace, et j’ai également testé les conversations téléphoniques, sans problème. La pleine charge est rapide et la durée de vie de la batterie peut atteindre plusieurs heures. Plusieurs pièces de rechange pour l’oreille dans la boîte peuvent offrir un confort optimal à de nombreuses personnes. Ils sont légers. L’entretien est parfait"
26,"Cette paire d'écouteur bluetooth est un véritable coup de coeur ! Elle possède une parfaite qualité de son, les basses sont géniales. C'est d'ailleurs la raison de mon coup de coeur. Elle est facile d'utilisation et très pratique: on peut changer de chanson, mettre en pause ou augmenter/baisser le son simplement en pressant les écouteurs. L'indicateur du niveau de batterie est très clair. D'ailleurs en parlant de batterie: elle est possède une grande autonomie. Je les utilise depuis 6 jours à raison d'1h par jour et ils n'ont toujours pas besoin d'être rechargé. Le maintien est topissime: les écouteurs ne bouge pas et son très confortables (testé lors de différentes activités telles que sport, ménage etc.). Certains se posent surement la question des lunettes: cela ne pose absolument aucun problème. Je porte moi même des lunettes, et c'est tout à fait confortable. Il suffit de bien positionner les écouteurs puis les lunettes. Donc n'hésitez pas à les acheter. En bref: un rapport qualité/prix plus qu'efficace, une qualité de son géniale, un confort et une autonomie assuré ! Foncez !"
27,"🚚Livraison : 2 jours avant la date prévue ! 📦Emballage : Reçut dans son emballage d'origine, lui-même dans un carton Amazon. ✂Déballage : À l'intérieur du carton : - Le boitier chargeur avec ses écouteurs, sobre, d'un noir mat plutôt élégant mais dommage qu'il y est le nom de la marque de marqué en gros car cela casse un peu l'effet. -Un sachet contenant une paire de porte écouteur en silicone de couleur jaune et 2 set d'adaptateur pour oreille de taille petite et grande. -Une notice en francais, courte mais qui vas à l'essentiel. -Un petit câble USB-C 💡Test : En suivant la notice et après pression de 3 sec sur chacun des écouteurs on voit bien que ceux-ci se connectent entre eux normalement. Le téléphone détecte et se connecte rapidement à ces derniers. Pour mon oreille j'ai gardé les embouts de base et ils s'adaptent sans soucis, je pense donc que les deux autres tailles conviendrons parfaitement à tous. Ils s'installent facilement et sont très légers. Après les avoir essayé pendant 3h non-stop durant une séance et VTT je peux affirmer qu'ils se portent super bien. Aucun des écouteurs n'as fait mine de partir, le son est très correct bien que la puissance soit juste ce qu'il faut et l'isolation est légère. En rentrant, je constate qu'ils leur restent plus de la moitié de la batterie, c'est une belle surprise ! L'autonomie est donc parfaitement plus que suffisante. 📄Bilan : Produit qui correspond largement à mes attentes, confortables, bon son et très bonne autonomie."
